clean_comment,usyk_sentiment,fury_sentiment
i agree with you fury only got past cunningham co he got tired but usyk wont i see fury failing into rope when he try to pin usyk down followed by a tap on shoulder [SEP] is the sentiment in favour or support of Oleksandr Usyk? is the sentiment in favour or support of Tyson Fury?,positive,negative
usyk will be in over his head he currently the most overrated fighter in boxing at the moment fury destroys this hypejob [SEP] is the sentiment in favour or support of Oleksandr Usyk? is the sentiment in favour or support of Tyson Fury?,negative,positive
i think usyk will try everything but tyson fury is another level [SEP] is the sentiment in favour or support of Oleksandr Usyk? is the sentiment in favour or support of Tyson Fury?,neutral,positive
the longer the fight go on the more it favour usyk imo fury need to dismantle him early hopefully the fight actually happens [SEP] is the sentiment in favour or support of Oleksandr Usyk? is the sentiment in favour or support of Tyson Fury?,positive,negative
fury ha an eilte jab nothing you ever mention usyk marked up by ajs what do you think an elite jab with larger reach donna do [SEP] is the sentiment in favour or support of Oleksandr Usyk? is the sentiment in favour or support of Tyson Fury?,negative,positive
usyk ha met big technical boxer many time in the past usyk is dangerous because he ha great footwork excellent iq and an engine imagine if tyson is tired after round yikes [SEP] is the sentiment in favour or support of Oleksandr Usyk? is the sentiment in favour or support of Tyson Fury?,positive,neutral
fury get a bad hand after the ngannou circus usyk v fury get postponed fury asking for more time than needed no other date come to fruition so usyk v fury get cancelled and now usyk will be fighting his mandatory hgrovic dont get hyped until fury get in the ring with usyk [SEP] is the sentiment in favour or support of Oleksandr Usyk? is the sentiment in favour or support of Tyson Fury?,neutral,negative
look like the wb whatever have told warren to piss off with his desperate appeal then eh only last week he wa talking about zhang getting the mando with usyk next year bloke couldnt lie straight in bed [SEP] is the sentiment in favour or support of Oleksandr Usyk? is the sentiment in favour or support of Tyson Fury?,neutral,neutral
i think it wa planned always fury needed a fight and two fight camp to drop his weight a i think he will come in light v usyk [SEP] is the sentiment in favour or support of Oleksandr Usyk? is the sentiment in favour or support of Tyson Fury?,neutral,positive
this ha been confirmed by the saudisteam usyk team furywhat more do you want [SEP] is the sentiment in favour or support of Oleksandr Usyk? is the sentiment in favour or support of Tyson Fury?,neutral,neutral
this is all promo for tyson upcoming fight he aint getting in that ring with usyk [SEP] is the sentiment in favour or support of Oleksandr Usyk? is the sentiment in favour or support of Tyson Fury?,neutral,negative
all the hater on this channel said it wouldnt happenwhen fury beat usyk youll have to admit fury the best of this era [SEP] is the sentiment in favour or support of Oleksandr Usyk? is the sentiment in favour or support of Tyson Fury?,negative,positive
i will believe it when they get in the ring until then it just speculation fury is trying to rebuild his rep after all the story he ha told about usyk not wanting the fight [SEP] is the sentiment in favour or support of Oleksandr Usyk? is the sentiment in favour or support of Tyson Fury?,neutral,negative
if it le than two month after the nganou fight then i dont see it happening not in december anyway unless fury make fast work of fn rooting for usyk all the way if it doe happen [SEP] is the sentiment in favour or support of Oleksandr Usyk? is the sentiment in favour or support of Tyson Fury?,positive,neutral
not quite sure i believe this tyson will find an excuse to not go through with it if it happens though i hope usyk run circle round him [SEP] is the sentiment in favour or support of Oleksandr Usyk? is the sentiment in favour or support of Tyson Fury?,positive,negative
let face it it wa a done deal for january or february this year but fury chose to fight chisora then go on holiday instead hell probably go on another holiday after the ngonnu fight fake injury retire then come back out of retirement after usyk sign to fight someone else [SEP] is the sentiment in favour or support of Oleksandr Usyk? is the sentiment in favour or support of Tyson Fury?,neutral,negative
trev and kj from the undisputed podcast said a couple of day ago that a boxer they know claimed he is scheduled to fight on the fury usyk undercard in saudi so the information line up [SEP] is the sentiment in favour or support of Oleksandr Usyk? is the sentiment in favour or support of Tyson Fury?,neutral,neutral
i highly doubt it i think this may be more of a marketing tool to sell ppvtickets for the ngannou fight and restore some of fury reputation given the public backlash we were sold the chirsora fight on the assumption that usyk wa next there using the same tactic here to calm public outrage [SEP] is the sentiment in favour or support of Oleksandr Usyk? is the sentiment in favour or support of Tyson Fury?,neutral,negative
i see your video read the title immediately did not believe it for a second xd if fury pull a trick like that quick turnaround and fight usyk before the end of the year well all have to shut our mouth still a fairy tale for now though [SEP] is the sentiment in favour or support of Oleksandr Usyk? is the sentiment in favour or support of Tyson Fury?,neutral,positive
dont believe a word that come out of team fury mouth other than fury saying he ha no interest in fighting usyk [SEP] is the sentiment in favour or support of Oleksandr Usyk? is the sentiment in favour or support of Tyson Fury?,neutral,negative
this wil never happen fury ha said he ha no intrest fighting usyk he doesnt want to face usyk or anyone with a pulse he the biggest fraud in boxing [SEP] is the sentiment in favour or support of Oleksandr Usyk? is the sentiment in favour or support of Tyson Fury?,neutral,negative
usyk had fury number and fury know it so he will never take the fight [SEP] is the sentiment in favour or support of Oleksandr Usyk? is the sentiment in favour or support of Tyson Fury?,positive,negative
i reckon it more gaslighting to keep fury name in people mind he out of shape there no way he prepared for usyk [SEP] is the sentiment in favour or support of Oleksandr Usyk? is the sentiment in favour or support of Tyson Fury?,neutral,negative
lie just to get people to not hate fury and buy the oct th fight keep the hate up and maybe he will fight usyk before he turn [SEP] is the sentiment in favour or support of Oleksandr Usyk? is the sentiment in favour or support of Tyson Fury?,neutral,negative
i dont believe it because he is fighting francis soon also fury said he didnt want to fight him he said after francis he wanted jon jones i wish he would fight usyk but highly doubtful [SEP] is the sentiment in favour or support of Oleksandr Usyk? is the sentiment in favour or support of Tyson Fury?,neutral,neutral
usyk could fight for free and i would be surprised if fury took it at this point [SEP] is the sentiment in favour or support of Oleksandr Usyk? is the sentiment in favour or support of Tyson Fury?,positive,negative
fury will fight usyk in after securing ngannou payday joshua will be ducking wilder and fury until his retirement [SEP] is the sentiment in favour or support of Oleksandr Usyk? is the sentiment in favour or support of Tyson Fury?,neutral,neutral
fury signed after usyk got a lucky win we know he weak to the body [SEP] is the sentiment in favour or support of Oleksandr Usyk? is the sentiment in favour or support of Tyson Fury?,negative,neutral
this would absolutely break the heart of the fury is ducking usyk idiot [SEP] is the sentiment in favour or support of Oleksandr Usyk? is the sentiment in favour or support of Tyson Fury?,neutral,positive
you have to admit it more likely fury figure out a way to make the fight not happen and then blame usyk for it i mean he been ducking aj for year why stop ducking now when he know he cant deal with the speed and actual master boxing skill usyk ha [SEP] is the sentiment in favour or support of Oleksandr Usyk? is the sentiment in favour or support of Tyson Fury?,positive,negative
eubank v benn massive then fury v usyk must be on a galactic level bitter hearn is hilarious [SEP] is the sentiment in favour or support of Oleksandr Usyk? is the sentiment in favour or support of Tyson Fury?,neutral,neutral
the same reason ppl say canelo beat crawford is the same reason fury beat usyk usyk ha proven to be a great heavyweight but fury would be considered a great super heavyweight [SEP] is the sentiment in favour or support of Oleksandr Usyk? is the sentiment in favour or support of Tyson Fury?,positive,positive
personally i think it going to be a boring fight from start to finish the table is tilted in favour of tyson fury for the simple fact that he ha more market value than usyk and if fury fight dirty it because he is allowed too [SEP] is the sentiment in favour or support of Oleksandr Usyk? is the sentiment in favour or support of Tyson Fury?,negative,negative
dont fall for all this signed contract talk tyson will never fight usyk and at the right moment will put a damper on this fight and blame the other side for failing to make it happen [SEP] is the sentiment in favour or support of Oleksandr Usyk? is the sentiment in favour or support of Tyson Fury?,neutral,negative
fight will never happen bricktop already know dubois won his appeal usyk will be forced to do an immediate rematch fury will create a pretext for an immediate rematch with ngannou it all a scheme [SEP] is the sentiment in favour or support of Oleksandr Usyk? is the sentiment in favour or support of Tyson Fury?,neutral,neutral
apart from huge one punch usyk ha all the tool in his magic box prepared for anything from fury the guy a winner high iq mentally physically strong and know how to adjust during a fight [SEP] is the sentiment in favour or support of Oleksandr Usyk? is the sentiment in favour or support of Tyson Fury?,positive,neutral
thats always been my view tha fury will beat everyone in this division by fighting dirty because he get away with it all the time including against whyte and wilder it will be the same situation against usyk and even easier [SEP] is the sentiment in favour or support of Oleksandr Usyk? is the sentiment in favour or support of Tyson Fury?,negative,negative
even cheating wont help fury he ha no chance against usyk fury is a bum and he will be exposed for the fraud he is he wont be able to hide anymore [SEP] is the sentiment in favour or support of Oleksandr Usyk? is the sentiment in favour or support of Tyson Fury?,positive,negative
we all know that if fury land the same body shot on usyk that dubois did itll be ruled a knock down [SEP] is the sentiment in favour or support of Oleksandr Usyk? is the sentiment in favour or support of Tyson Fury?,negative,positive
if the fight happens when fury get dirty it would be great to see usyk respond like he did with dubois get angry and turn it up to until fury quits [SEP] is the sentiment in favour or support of Oleksandr Usyk? is the sentiment in favour or support of Tyson Fury?,positive,negative
listen i recon usyk can play do dirty shit tojust because he well spoken respectful dont mean he not capable of being nasty in the ring if he need tohes gon na fight a man who disrespected him for month so usyk will want to get some get back and punish fury [SEP] is the sentiment in favour or support of Oleksandr Usyk? is the sentiment in favour or support of Tyson Fury?,positive,negative
im already seeing premeditated excuse for when usyk loses kurt know he will have to swallow his word about usyk beating fury [SEP] is the sentiment in favour or support of Oleksandr Usyk? is the sentiment in favour or support of Tyson Fury?,negative,positive
ill stick to my prediction usyk will make fury quit fury will probably feign an injury to save face [SEP] is the sentiment in favour or support of Oleksandr Usyk? is the sentiment in favour or support of Tyson Fury?,positive,negative
no way usyk beat fury [SEP] is the sentiment in favour or support of Oleksandr Usyk? is the sentiment in favour or support of Tyson Fury?,negative,positive
im sure usyk ha seen those fight n is prepared for itwhether he can execute his evasion planswho knowsyes flab king will try sm dodgy stuntsi guess easy fight clean fightn usyk dsnt seem like an easy fightlet it happen n we will find out [SEP] is the sentiment in favour or support of Oleksandr Usyk? is the sentiment in favour or support of Tyson Fury?,positive,negative
usyk will be to fast for slow tyson [SEP] is the sentiment in favour or support of Oleksandr Usyk? is the sentiment in favour or support of Tyson Fury?,positive,negative
yeah of course fury will box usyk and pig will fly [SEP] is the sentiment in favour or support of Oleksandr Usyk? is the sentiment in favour or support of Tyson Fury?,neutral,negative
hrgovic v zhang should rematch a they wait for fury v usyk seeing a alot of people think he won first won [SEP] is the sentiment in favour or support of Oleksandr Usyk? is the sentiment in favour or support of Tyson Fury?,neutral,neutral
buzzing fury v usyk is finally happening [SEP] is the sentiment in favour or support of Oleksandr Usyk? is the sentiment in favour or support of Tyson Fury?,neutral,neutral
frank sorry fella but usyk is a better boxer then fury better angle better footwork in and out and all about also much quicker set trap always and pound pound great even more so now tyson think he a bruiser [SEP] is the sentiment in favour or support of Oleksandr Usyk? is the sentiment in favour or support of Tyson Fury?,positive,negative
new title frank reveals nothing new about fury v usyk but make a few decent joke about builder [SEP] is the sentiment in favour or support of Oleksandr Usyk? is the sentiment in favour or support of Tyson Fury?,neutral,neutral
i dont believe frank with regard to furyusyk he very guarded [SEP] is the sentiment in favour or support of Oleksandr Usyk? is the sentiment in favour or support of Tyson Fury?,neutral,neutral
the title say warren reveals detail of fury v usyk but im struggling to find the part in the video where he reveals the date and venue im sure it in here somewhere because youve stated a much in the title i just cant find it [SEP] is the sentiment in favour or support of Oleksandr Usyk? is the sentiment in favour or support of Tyson Fury?,neutral,neutral
frank look like he swaying about some med or red wine the only reason fury usyk ha been announced is to give fury nganu fight some credit frank pissed [SEP] is the sentiment in favour or support of Oleksandr Usyk? is the sentiment in favour or support of Tyson Fury?,neutral,neutral
frank look year younger since tyson v usyk agreement [SEP] is the sentiment in favour or support of Oleksandr Usyk? is the sentiment in favour or support of Tyson Fury?,neutral,neutral
usyk agreed to fight fury only if they dropped the dubois appeal fact sneaky warren [SEP] is the sentiment in favour or support of Oleksandr Usyk? is the sentiment in favour or support of Tyson Fury?,neutral,neutral
retire frank your a joke now fury usyk will stink place out then frank will put another mma fighter on ffs [SEP] is the sentiment in favour or support of Oleksandr Usyk? is the sentiment in favour or support of Tyson Fury?,neutral,neutral
fury win usyk didnt fight a well a usual when fighting dubois which he had to cheat to win dubois won that fight fury agrees with that to and will make sure he teach usyk a lesson also cant wait for ngannou v fury oct th god bless [SEP] is the sentiment in favour or support of Oleksandr Usyk? is the sentiment in favour or support of Tyson Fury?,negative,positive
he is weak to the stomach a couple of fighter hurt him usyk fighting at cruiser weight for the title the big hitting blonde haired cruiser weight fighter hurt him to the midriff aj went to the midriff this will be in tyson plan ok [SEP] is the sentiment in favour or support of Oleksandr Usyk? is the sentiment in favour or support of Tyson Fury?,negative,positive
usyk cant hurt fury so how do you keep a pound man off you with just a good or better stamen then you in a boxing match fury win late round stoppage or point he can do both [SEP] is the sentiment in favour or support of Oleksandr Usyk? is the sentiment in favour or support of Tyson Fury?,negative,positive
fury outboxes usyk then knock him out within round fury will be disguising that body shot all fight then boom until then jab jab jab [SEP] is the sentiment in favour or support of Oleksandr Usyk? is the sentiment in favour or support of Tyson Fury?,negative,positive
ill be impressed with fury if he doe actually get in the ring with usyk a i dont think he belief hell beat him usyk seems supremely confident that hell beat fury though [SEP] is the sentiment in favour or support of Oleksandr Usyk? is the sentiment in favour or support of Tyson Fury?,positive,negative
calm down fury aint fighting usyk it just a way to give the fury ngannou fight cred [SEP] is the sentiment in favour or support of Oleksandr Usyk? is the sentiment in favour or support of Tyson Fury?,neutral,neutral
the knowledge spiritfearon backing the brit wonder if usyk will target that body [SEP] is the sentiment in favour or support of Oleksandr Usyk? is the sentiment in favour or support of Tyson Fury?,neutral,positive
fury ha taken this fight because dubois shown vulnerability that usyk ha fury belief now he can take him out [SEP] is the sentiment in favour or support of Oleksandr Usyk? is the sentiment in favour or support of Tyson Fury?,negative,positive
told the casuals for the longest fury wa gon na fight usyk only casuals thought fury wa ducking him [SEP] is the sentiment in favour or support of Oleksandr Usyk? is the sentiment in favour or support of Tyson Fury?,neutral,positive
usyk v fury is a million x better who is bank eubank anyways [SEP] is the sentiment in favour or support of Oleksandr Usyk? is the sentiment in favour or support of Tyson Fury?,positive,positive
usyk is so much smarter of a fighter than fury he will beat him on point handily [SEP] is the sentiment in favour or support of Oleksandr Usyk? is the sentiment in favour or support of Tyson Fury?,positive,negative
wilder viciously and spectaculary ko joshua inside round and fury lean all over usyk and stop him around the th round [SEP] is the sentiment in favour or support of Oleksandr Usyk? is the sentiment in favour or support of Tyson Fury?,negative,positive
taking advice on beating usyk from tony bellend is like taking relationship advice from wayne rooney [SEP] is the sentiment in favour or support of Oleksandr Usyk? is the sentiment in favour or support of Tyson Fury?,neutral,negative
switched up his whole narrative now fury need to give up all his advantage to beat usyk [SEP] is the sentiment in favour or support of Oleksandr Usyk? is the sentiment in favour or support of Tyson Fury?,positive,negative
bellews face when fury beat usyk [SEP] is the sentiment in favour or support of Oleksandr Usyk? is the sentiment in favour or support of Tyson Fury?,negative,positive
why are people debating whats bigger furyusyk v eubankbenn but then again it only matchroom simps and co that are saying that we all know fury v usyk is the biggest fight in boxing [SEP] is the sentiment in favour or support of Oleksandr Usyk? is the sentiment in favour or support of Tyson Fury?,neutral,neutral
haha the bell end didnt want to admit that hed watch furyusyk over the pony eubank v benn domestic fight [SEP] is the sentiment in favour or support of Oleksandr Usyk? is the sentiment in favour or support of Tyson Fury?,neutral,neutral
im adamant tyson is more likely to fight someone called adam and someone called ant than fight usyk at any point [SEP] is the sentiment in favour or support of Oleksandr Usyk? is the sentiment in favour or support of Tyson Fury?,neutral,negative
fury would of made more money to fight usyk in saudi but he wanted more money than wa in the whol pot usyk signed for that fight it isnt about money it about fury being scared [SEP] is the sentiment in favour or support of Oleksandr Usyk? is the sentiment in favour or support of Tyson Fury?,positive,negative
tyson cant get sober for a proper camp currently if we never see the usyk fight thats the probable reason [SEP] is the sentiment in favour or support of Oleksandr Usyk? is the sentiment in favour or support of Tyson Fury?,neutral,negative
always been huge fury fan but getting fedup of this greed and money talk get on and fight usyk and aj or vacate the belt and retire it beyond a joke now [SEP] is the sentiment in favour or support of Oleksandr Usyk? is the sentiment in favour or support of Tyson Fury?,neutral,negative
the saudi are hot for the fury right now because aj stunk the place out in ruiz usyk rematch [SEP] is the sentiment in favour or support of Oleksandr Usyk? is the sentiment in favour or support of Tyson Fury?,neutral,positive
fury wont fight usyk coz if he doe and becomes one champion it will be mandatory after mandatory [SEP] is the sentiment in favour or support of Oleksandr Usyk? is the sentiment in favour or support of Tyson Fury?,neutral,neutral
strangely after usyk v dubois fury want to fight usyk [SEP] is the sentiment in favour or support of Oleksandr Usyk? is the sentiment in favour or support of Tyson Fury?,neutral,neutral
there are two fight the public want to see imo tyson v usyk and tyson v josh then it is done for this era [SEP] is the sentiment in favour or support of Oleksandr Usyk? is the sentiment in favour or support of Tyson Fury?,neutral,neutral
well usyk cant duck fury forever now can he maybe fury offering a fight for rd time might be the charm [SEP] is the sentiment in favour or support of Oleksandr Usyk? is the sentiment in favour or support of Tyson Fury?,negative,positive
fury v aj aj v wilder usyk v fury wilder v usyk fury v ruiz usyk v wilder any of those fight please the rest i dont care [SEP] is the sentiment in favour or support of Oleksandr Usyk? is the sentiment in favour or support of Tyson Fury?,neutral,neutral
were more likely to get fury v usyk than aj v wilder [SEP] is the sentiment in favour or support of Oleksandr Usyk? is the sentiment in favour or support of Tyson Fury?,neutral,neutral
fury is a disgrace if he step into an octagon he get destroyed easily he should focus on undisputed with usyk [SEP] is the sentiment in favour or support of Oleksandr Usyk? is the sentiment in favour or support of Tyson Fury?,neutral,negative
fury said from his own mouth that he aint fighting boxer again because they dont generate enough money and all these wet wipe defending him billion wouldnt get fury in the ring with usyk [SEP] is the sentiment in favour or support of Oleksandr Usyk? is the sentiment in favour or support of Tyson Fury?,neutral,negative
fury is no longer a boxer he a clown in a circus fury usyk is not guna happen simple a that [SEP] is the sentiment in favour or support of Oleksandr Usyk? is the sentiment in favour or support of Tyson Fury?,neutral,negative
the worst thing that could happen is if aj duck wilder and ruiz and wilder v ruiz doesnt get made and then wilder fight usyk because then what wilder v fury a wilder leaf usyk twitching on the canvas [SEP] is the sentiment in favour or support of Oleksandr Usyk? is the sentiment in favour or support of Tyson Fury?,negative,neutral
not a chance fury know how good usyk is and will continue to avoid him until he retires again [SEP] is the sentiment in favour or support of Oleksandr Usyk? is the sentiment in favour or support of Tyson Fury?,positive,negative
is there any truth to the rumor circulating hollywood that olexander usyk fury andy montana ruiz dillian whyte daniel dubois and especially anthony joshua are still afraid of deontay wilder yes or no agile mobil and hostile bomb squad [SEP] is the sentiment in favour or support of Oleksandr Usyk? is the sentiment in favour or support of Tyson Fury?,neutral,neutral
hateman is eating humble pie and is cry on the inside that fury v usyk is happening meanwhile aj v wilder failed to make undisputed oops [SEP] is the sentiment in favour or support of Oleksandr Usyk? is the sentiment in favour or support of Tyson Fury?,neutral,neutral
fury will fight francis get injured and pull out of the usyk fight the perfect excuse to save face and not actually fight usyk [SEP] is the sentiment in favour or support of Oleksandr Usyk? is the sentiment in favour or support of Tyson Fury?,neutral,negative
fury is gon na batter that ukrainian dosser cant wait [SEP] is the sentiment in favour or support of Oleksandr Usyk? is the sentiment in favour or support of Tyson Fury?,negative,positive
gypsy queen will make some outrageous demand to avoid fighting usyk just like he did the last time until i see greedy belly in the ring with usyk ill never believe it [SEP] is the sentiment in favour or support of Oleksandr Usyk? is the sentiment in favour or support of Tyson Fury?,neutral,negative
hatman how much do you want to bet fury doesnt fight usyk in december or january maybe this time next year maybe [SEP] is the sentiment in favour or support of Oleksandr Usyk? is the sentiment in favour or support of Tyson Fury?,neutral,neutral
tyson fury will not fight usyk because he will move the goal post again [SEP] is the sentiment in favour or support of Oleksandr Usyk? is the sentiment in favour or support of Tyson Fury?,neutral,negative
